{
  "$schema": "https://json-schema.org/draft/2020-12/schema",
  "$id": "https://agent-plugins.org/schemas/1.0.0/plugin.schema.json",
  "title": "Agent Plugins Manifest",
  "description": "Vendored Agent Plugins 1.0.0 plugin.json schema. Spec: https://agent-plugins.org/specification",
  "type": "object",
  "properties": {
    "$schema": {
      "const": "https://agent-plugins.org/schemas/1.0.0/plugin.schema.json"
    },
    "name": {
      "type": "string",
      "minLength": 1,
      "maxLength": 64,
      "pattern": "^(?!.*(?:--|\\.\\.))[a-z0-9](?:[a-z0-9.-]*[a-z0-9])?$"
    },
    "version": { "type": "string" },
    "description": { "type": "string" },
    "author": {
      "type": "object",
      "properties": {
        "name": { "type": "string" },
        "email": { "type": "string" },
        "url": { "type": "string" }
      },
      "additionalProperties": false
    },
    "homepage": { "type": "string" },
    "repository": { "type": "string" },
    "license": { "type": "string" },
    "keywords": {
      "type": "array",
      "items": { "type": "string" }
    },
    "extensions": {
      "type": "object",
      "additionalProperties": { "type": "object" }
    }
  },
  "required": ["$schema", "name"],
  "additionalProperties": false
}
