{
  "$schema": "https://agent-plugins.org/schemas/1.0.0/plugin.schema.json",
  "name": "microduck-plugin",
  "version": "0.1.16",
  "description": "Agent Plugins 1.0 package: train, export, publish, drive a sim Microduck on localhost, and deploy RL policies. robotctl runs only when the user asks to install on a robot they own.",
  "license": "MIT",
  "author": {
    "name": "acnlabs",
    "url": "https://github.com/acnlabs"
  },
  "keywords": [
    "agent-plugins",
    "microduck",
    "pollen-robotics",
    "reinforcement-learning",
    "sim2real",
    "huggingface"
  ],
  "homepage": "https://github.com/acnlabs/microduck-plugin",
  "repository": "https://github.com/acnlabs/microduck-plugin"
}
